{
  "schemaVersion": "1.0",
  "ruleId": "EDGE-BASELINE-MIG-001",
  "migrationId": "EDGE-BASELINE-MIG-TRUST-POLICY-SEPARATION-002",
  "issuedAgainstRevision": "538367be815c8b23a0317e9be425f3eb80aaaa42",
  "issuedAtUtc": "2026-07-13T05:28:36Z",
  "expiresAtUtc": "2026-07-20T05:28:36Z",
  "owner": "Edge.Architecture",
  "approvedBy": "ShuJinHao",
  "reason": "Authorize the isolated validator upgrade that forbids baseline and governance policy changes in one receipt.",
  "ruleIds": [
    "EDGE-BASELINE-TRUST-UPGRADE-001"
  ],
  "source": {
    "baselineSha256": "7e57a6e9a4028a99c3afaf611f635045caa35f62148aa7e6aba85c25a487f97a",
    "protectedManifestSha256": "8418c47c790234ef602d157ab32d5d91664b7e640d00a7e3a1cae4f16b2d9e60",
    "counts": {
      "repositoryProjects": 32,
      "testProjects": 7,
      "testSourceFiles": 132,
      "declarations": 964,
      "executionTemplates": 1010,
      "projectedCases": 1091,
      "runnerCases": 1091
    }
  },
  "target": {
    "baselineSha256": "7e57a6e9a4028a99c3afaf611f635045caa35f62148aa7e6aba85c25a487f97a",
    "protectedManifestSha256": "5d0bebc7e9033e134c9973a82409cb6b45fa3aeb960fe916daff78fa6053a3fa",
    "counts": {
      "repositoryProjects": 32,
      "testProjects": 7,
      "testSourceFiles": 132,
      "declarations": 964,
      "executionTemplates": 1010,
      "projectedCases": 1091,
      "runnerCases": 1091
    }
  },
  "projectChanges": {
    "added": [],
    "removed": [],
    "addedTests": [],
    "removedTests": []
  },
  "changes": [
    {
      "path": "scripts/tests/baselines/migrations/TestEdgeBaselineMigrationValidator.v1.ps1",
      "status": "M",
      "beforeMode": "100644",
      "beforeSha256": "10a7681bd2abe458c7589a98464ea0540c0393cce33a507bc35241c3598dbcfa",
      "afterMode": "100644",
      "afterSha256": "abfc748768425a990c7567202c34e87158617fdf83f1a0fc1363e310e044e30f"
    },
    {
      "path": "scripts/tests/baselines/migrations/ValidateEdgeBaselineMigration.v1.ps1",
      "status": "M",
      "beforeMode": "100644",
      "beforeSha256": "317f72da2b87367b063ffe1ea2f3e119c52cb339e0dd321797b4d2c706ac47c9",
      "afterMode": "100644",
      "afterSha256": "9baf37a9244b15fca2359bc88c5fe6574d6ec62ae887e0feeae45895fe11c1d2"
    }
  ]
}
